loaded /home/tamara/.profile
tamara@caesar:~$ php -r '$a[0]=1; echo &$a[0]; echo "\n";'
PHP Parse error:  syntax error, unexpected '&' in Command line code on line 1
tamara@caesar:~$ php -r '$a[0]=1; $b =  &$a[0]; echo "$b\n";'
1
tamara@caesar:~$ php -r '$a[0]=1; $b =  $a[0]; echo "$b\n";'
1
tamara@caesar:~$ ^C
tamara@caesar:~$ php -r '$a[0]=1; $b =  $a[0]; echo "$b\n"; echo ref($b)."\n";'
1
PHP Fatal error:  Call to undefined function ref() in Command line code on line 1
PHP Stack trace:
PHP   1. {main}() Command line code:0
tamara@caesar:~$ php -r '$a[0]=1; $b =  $a[0]; echo "$b\n"; echo ref $b."\n";'
PHP Parse error:  syntax error, unexpected T_VARIABLE, expecting ',' or ';' in Command line code on line 1
tamara@caesar:~$ php -r '$a[0]=1; $b =  $a[0]; echo "$b\n"; echo (ref $b)."\n";'
PHP Parse error:  syntax error, unexpected T_VARIABLE in Command line code on line 1
tamara@caesar:~$ pushd Projects/examples/
~/Projects/examples ~
tamara@caesar:~/Projects/examples$ mkdir manytomany
tamara@caesar:~/Projects/examples$ pushd manytomany/
~/Projects/examples/manytomany ~/Projects/examples ~
tamara@caesar:~/Projects/examples/manytomany$ git init .
Initialized empty Git repository in /home/tamara/Projects/examples/manytomany/.git/
tamara@caesar:~/Projects/examples/manytomany$ cp ../../std.gitignore .gitignore
`../../std.gitignore' -> `.gitignore'
tamara@caesar:~/Projects/examples/manytomany$ more .gitignore 
# Ignore the usual suspects
# emacs backups and intermediate files
*~
\#*\#
.\#*

# filter backups
*.bak

# compressed archives
*.Z
*.zip
*.gz
*.tar
*.tgz
*.bz2
*.bzip2
tamara@caesar:~/Projects/examples/manytomany$ ll
total 8.0K
drwxrwxr-x 7 tamara tamara 4.0K 2012-11-26 21:35 .git/
-rw-r--r-- 1 tamara tamara  169 2012-11-26 21:35 .gitignore
tamara@caesar:~/Projects/examples/manytomany$ git commit -a 'initial commit'
fatal: Paths with -a does not make sense.
tamara@caesar:~/Projects/examples/manytomany$ emacs .
tamara@caesar:~/Projects/examples/manytomany$ ll
total 12K
drwxrwxr-x 7 tamara tamara 4.0K 2012-11-26 21:35 .git/
-rw-r--r-- 1 tamara tamara  169 2012-11-26 21:35 .gitignore
-rw-rw-r-- 1 tamara tamara  738 2012-11-26 21:46 schema.sql
tamara@caesar:~/Projects/examples/manytomany$ mysql -u root -p
Enter password: 
ERROR 1045 (28000): Access denied for user 'root'@'localhost' (using password: YES)
tamara@caesar:~/Projects/examples/manytomany$ mysql -u root -p
Enter password: 
Welcome to the MySQL monitor.  Commands end with ; or \g.
Your MySQL connection id is 41
Server version: 5.1.66-0ubuntu0.11.10.2 (Ubuntu)

Copyright (c) 2000, 2012, Oracle and/or its affiliates. All rights reserved.

Oracle is a registered trademark of Oracle Corporation and/or its
affiliates. Other names may be trademarks of their respective
owners.

Type 'help;' or '\h' for help. Type '\c' to clear the current input statement.

mysql> show databases;
+--------------------+
| Database           |
+--------------------+
| information_schema |
| mikeqdb            |
| mysql              |
| testfileupload     |
| wpstories          |
+--------------------+
5 rows in set (0.33 sec)

mysql> create database examples;
Query OK, 1 row affected (0.00 sec)

mysql> show databases;
+--------------------+
| Database           |
+--------------------+
| information_schema |
| examples           |
| mikeqdb            |
| mysql              |
| testfileupload     |
| wpstories          |
+--------------------+
6 rows in set (0.00 sec)

mysql> help

For information about MySQL products and services, visit:
   http://www.mysql.com/
For developer information, including the MySQL Reference Manual, visit:
   http://dev.mysql.com/
To buy MySQL Enterprise support, training, or other products, visit:
   https://shop.mysql.com/

List of all MySQL commands:
Note that all text commands must be first on line and end with ';'
?         (\?) Synonym for `help'.
clear     (\c) Clear the current input statement.
connect   (\r) Reconnect to the server. Optional arguments are db and host.
delimiter (\d) Set statement delimiter.
edit      (\e) Edit command with $EDITOR.
ego       (\G) Send command to mysql server, display result vertically.
exit      (\q) Exit mysql. Same as quit.
go        (\g) Send command to mysql server.
help      (\h) Display this help.
nopager   (\n) Disable pager, print to stdout.
notee     (\t) Don't write into outfile.
pager     (\P) Set PAGER [to_pager]. Print the query results via PAGER.
print     (\p) Print current command.
prompt    (\R) Change your mysql prompt.
quit      (\q) Quit mysql.
rehash    (\#) Rebuild completion hash.
source    (\.) Execute an SQL script file. Takes a file name as an argument.
status    (\s) Get status information from the server.
system    (\!) Execute a system shell command.
tee       (\T) Set outfile [to_outfile]. Append everything into given outfile.
use       (\u) Use another database. Takes database name as argument.
charset   (\C) Switch to another charset. Might be needed for processing binlog with multi-byte charsets.
warnings  (\W) Show warnings after every statement.
nowarning (\w) Don't show warnings after every statement.

For server side help, type 'help contents'

mysql> source schema.sql
ERROR 1046 (3D000): No database selected
ERROR 1046 (3D000): No database selected
ERROR 1046 (3D000): No database selected
ERROR 1046 (3D000): No database selected
ERROR 1046 (3D000): No database selected
ERROR 1046 (3D000): No database selected
mysql> use examples;
Database changed
mysql> source schema.sql
Query OK, 0 rows affected, 1 warning (0.01 sec)

Query OK, 0 rows affected (0.14 sec)

Query OK, 0 rows affected, 1 warning (0.00 sec)

Query OK, 0 rows affected (0.10 sec)

Query OK, 0 rows affected, 1 warning (0.00 sec)

Query OK, 0 rows affected (0.08 sec)

mysql> show tables;
+--------------------+
| Tables_in_examples |
+--------------------+
| discounts          |
| users              |
| usersdiscounts     |
+--------------------+
3 rows in set (0.00 sec)

mysql> explain users;
+----------+--------------+------+-----+---------+----------------+
| Field    | Type         | Null | Key | Default | Extra          |
+----------+--------------+------+-----+---------+----------------+
| id       | int(11)      | NO   | PRI | NULL    | auto_increment |
| username | varchar(200) | YES  | UNI | NULL    |                |
| email    | varchar(200) | YES  |     | NULL    |                |
+----------+--------------+------+-----+---------+----------------+
3 rows in set (0.02 sec)

mysql> explain discounts;
+--------------+--------------+------+-----+---------+----------------+
| Field        | Type         | Null | Key | Default | Extra          |
+--------------+--------------+------+-----+---------+----------------+
| id           | int(11)      | NO   | PRI | NULL    | auto_increment |
| discountcode | varchar(20)  | YES  | UNI | NULL    |                |
| discountrate | decimal(4,2) | YES  |     | NULL    |                |
+--------------+--------------+------+-----+---------+----------------+
3 rows in set (0.02 sec)

mysql> explain usersdiscounts;
+-------------+---------+------+-----+---------+-------+
| Field       | Type    | Null | Key | Default | Extra |
+-------------+---------+------+-----+---------+-------+
| user_id     | int(11) | NO   | PRI | NULL    |       |
| discount_id | int(11) | NO   | PRI | NULL    |       |
+-------------+---------+------+-----+---------+-------+
2 rows in set (0.00 sec)

mysql> insert into discounts (discountcode, rate) VALUES ('a1',20.0);
ERROR 1054 (42S22): Unknown column 'rate' in 'field list'
mysql> insert into discounts (discountcode, discountrate) VALUES ('a1',20.0);
Query OK, 1 row affected (0.03 sec)

mysql> select * from discounts;
+----+--------------+--------------+
| id | discountcode | discountrate |
+----+--------------+--------------+
|  1 | a1           |        20.00 |
+----+--------------+--------------+
1 row in set (0.01 sec)

mysql> insert into discounts (discountcode, discountrate) VALUES ('a2',10.5);
Query OK, 1 row affected (0.00 sec)

mysql> select * from discounts;
+----+--------------+--------------+
| id | discountcode | discountrate |
+----+--------------+--------------+
|  1 | a1           |        20.00 |
|  2 | a2           |        10.50 |
+----+--------------+--------------+
2 rows in set (0.00 sec)

mysql> insert into users (username, email) values ('axel','axel@example.com');
Query OK, 1 row affected (0.00 sec)

mysql> insert into users (username, email) values ('jones','jones@example.com');
Query OK, 1 row affected (0.00 sec)

mysql> insert into users (username, email) values ('fergie','fergie@example.com');
Query OK, 1 row affected (0.00 sec)

mysql> select * from users;
+----+----------+--------------------+
| id | username | email              |
+----+----------+--------------------+
|  1 | axel     | axel@example.com   |
|  2 | jones    | jones@example.com  |
|  3 | fergie   | fergie@example.com |
+----+----------+--------------------+
3 rows in set (0.00 sec)

mysql> insert into usersdiscount (user_id, discount_id) VALUES (1,1);
ERROR 1146 (42S02): Table 'examples.usersdiscount' doesn't exist
mysql> insert into usersdiscounts (user_id, discount_id) VALUES (1,1);
Query OK, 1 row affected (0.00 sec)

mysql> select id as userid, username, email, discountcode, discountrate from users, discounts, usersdiscounts
    -> where users.id = usersdiscounts.userid and
    -> discounts.id = usersdscounts.discountid;
ERROR 1052 (23000): Column 'id' in field list is ambiguous
mysql> select user.id as userid, username, email, discountcode, discountrate from users, discounts, usersdiscounts where users.id = usersdiscounts.userid and discounts.id = usersdscounts.discountid;
ERROR 1054 (42S22): Unknown column 'user.id' in 'field list'
mysql> select users.id as userid, username, email, discountcode, discountrate from users, discounts, usersdiscounts where users.id = usersdiscounts.userid and discounts.id = usersdscounts.discountid;
ERROR 1054 (42S22): Unknown column 'usersdiscounts.userid' in 'where clause'
mysql> select users.id as userid, username, email, discountcode, discountrate from users, discounts, usersdiscounts where users.id = usersdiscounts.user_id and discounts.id = usersdscounts.discount_id;
ERROR 1054 (42S22): Unknown column 'usersdscounts.discount_id' in 'where clause'
mysql> select users.id as userid, username, email, discountcode, discountrate from users, discounts, usersdiscounts where users.id = usersdiscounts.user_id and discounts.id = usersdiscounts.discount_id;
+--------+----------+------------------+--------------+--------------+
| userid | username | email            | discountcode | discountrate |
+--------+----------+------------------+--------------+--------------+
|      1 | axel     | axel@example.com | a1           |        20.00 |
+--------+----------+------------------+--------------+--------------+
1 row in set (0.00 sec)

mysql> insert into usersdiscounts (user_id, discount_id) VALUES (1,2);Query OK, 1 row affected (0.00 sec)

mysql> select users.id as userid, username, email, discountcode, discountrate from users, discounts, usersdiscounts where users.id = usersdiscounts.user_id and discounts.id = usersdiscounts.discount_id;
+--------+----------+------------------+--------------+--------------+
| userid | username | email            | discountcode | discountrate |
+--------+----------+------------------+--------------+--------------+
|      1 | axel     | axel@example.com | a1           |        20.00 |
|      1 | axel     | axel@example.com | a2           |        10.50 |
+--------+----------+------------------+--------------+--------------+
2 rows in set (0.00 sec)

mysql> delete from users where id = 1;
Query OK, 1 row affected (0.00 sec)

mysql> select users.id as userid, username, email, discountcode, discountrate from users, discounts, usersdiscounts where users.id = usersdiscounts.user_id and discounts.id = usersdiscounts.discount_id;
Empty set (0.00 sec)

mysql> select * from usersdiscounts;
+---------+-------------+
| user_id | discount_id |
+---------+-------------+
|       1 |           1 |
|       1 |           2 |
+---------+-------------+
2 rows in set (0.00 sec)

mysql> source schema
ERROR: 
Failed to open file 'schema', error: 2
mysql> source schema.sql
Query OK, 0 rows affected (0.00 sec)

ERROR 1064 (42000): You have an error in your SQL syntax; check the manual that corresponds to your MySQL server version for the right syntax to use near 'InnoDB' at line 5
Query OK, 0 rows affected (0.00 sec)

ERROR 1064 (42000): You have an error in your SQL syntax; check the manual that corresponds to your MySQL server version for the right syntax to use near 'InnoDB' at line 5
Query OK, 0 rows affected (0.00 sec)

ERROR 1064 (42000): You have an error in your SQL syntax; check the manual that corresponds to your MySQL server version for the right syntax to use near 'InnoDB' at line 15
mysql> source schema.sql
Query OK, 0 rows affected, 1 warning (0.00 sec)

Query OK, 0 rows affected (0.29 sec)

Query OK, 0 rows affected, 1 warning (0.00 sec)

Query OK, 0 rows affected (0.13 sec)

Query OK, 0 rows affected, 1 warning (0.00 sec)

Query OK, 0 rows affected (0.19 sec)

mysql> show tables;
+--------------------+
| Tables_in_examples |
+--------------------+
| discounts          |
| users              |
| usersdiscounts     |
+--------------------+
3 rows in set (0.00 sec)

mysql> explain users
    -> ;
+----------+--------------+------+-----+---------+----------------+
| Field    | Type         | Null | Key | Default | Extra          |
+----------+--------------+------+-----+---------+----------------+
| id       | int(11)      | NO   | PRI | NULL    | auto_increment |
| username | varchar(200) | YES  | UNI | NULL    |                |
| email    | varchar(200) | YES  |     | NULL    |                |
+----------+--------------+------+-----+---------+----------------+
3 rows in set (0.00 sec)

mysql> insert into users (username, email) values ('joe','joe@example.com'), ('jane','jane@example.com'), ('pat','pat@example.com');
Query OK, 3 rows affected (0.04 sec)
Records: 3  Duplicates: 0  Warnings: 0

mysql> select all from usersdiscounts;
ERROR 1064 (42000): You have an error in your SQL syntax; check the manual that corresponds to your MySQL server version for the right syntax to use near 'from usersdiscounts' at line 1
mysql> select * from usersdiscounts;
Empty set (0.00 sec)

mysql> insert into discounts (discountcode,discountrate) VALUES ('d1',20.0), ('d2',10.5);
Query OK, 2 rows affected (0.09 sec)
Records: 2  Duplicates: 0  Warnings: 0

mysql> select * from discounts;
+----+--------------+--------------+
| id | discountcode | discountrate |
+----+--------------+--------------+
|  1 | d1           |        20.00 |
|  2 | d2           |        10.50 |
+----+--------------+--------------+
2 rows in set (0.00 sec)

mysql> insert into usersdiscounts (user_id, discount_id) VALUES (1,1), (1,2), (2,2), (3,1);
Query OK, 4 rows affected (0.05 sec)
Records: 4  Duplicates: 0  Warnings: 0

mysql> select * from usersdiscounts;
+---------+-------------+
| user_id | discount_id |
+---------+-------------+
|       1 |           1 |
|       3 |           1 |
|       1 |           2 |
|       2 |           2 |
+---------+-------------+
4 rows in set (0.00 sec)

mysql> select users.id as uid, username, email, discountcode, discountrate from users, discounts, usersdiscounts where users.id = usersdiscounts.user_id and discount.id = usersdiscounts.discount_id;
ERROR 1054 (42S22): Unknown column 'discount.id' in 'where clause'
mysql> select users.id as uid, username, email, discountcode, discountrate from users, discounts, usersdiscounts where users.id = usersdiscounts.user_id and discounts.id = usersdiscounts.discount_id;
+-----+----------+------------------+--------------+--------------+
| uid | username | email            | discountcode | discountrate |
+-----+----------+------------------+--------------+--------------+
|   1 | joe      | joe@example.com  | d1           |        20.00 |
|   1 | joe      | joe@example.com  | d2           |        10.50 |
|   2 | jane     | jane@example.com | d2           |        10.50 |
|   3 | pat      | pat@example.com  | d1           |        20.00 |
+-----+----------+------------------+--------------+--------------+
4 rows in set (0.01 sec)

mysql> delete from users where username = 'pat';
Query OK, 1 row affected (0.04 sec)

mysql> select users.id as uid, username, email, discountcode, discountrate from users, discounts, usersdiscounts where users.id = usersdiscounts.user_id and discounts.id = usersdiscounts.discount_id;
+-----+----------+------------------+--------------+--------------+
| uid | username | email            | discountcode | discountrate |
+-----+----------+------------------+--------------+--------------+
|   1 | joe      | joe@example.com  | d1           |        20.00 |
|   1 | joe      | joe@example.com  | d2           |        10.50 |
|   2 | jane     | jane@example.com | d2           |        10.50 |
+-----+----------+------------------+--------------+--------------+
3 rows in set (0.00 sec)

mysql> select * from usersdiscounts;
+---------+-------------+
| user_id | discount_id |
+---------+-------------+
|       1 |           1 |
|       1 |           2 |
|       2 |           2 |
+---------+-------------+
3 rows in set (0.00 sec)

mysql> delete from discounts where discountcode = 'd2';
Query OK, 1 row affected (0.05 sec)

mysql> select users.id as uid, username, email, discountcode, discountrate from users, discounts, usersdiscounts where users.id = usersdiscounts.user_id and discounts.id = usersdiscounts.discount_id;
+-----+----------+-----------------+--------------+--------------+
| uid | username | email           | discountcode | discountrate |
+-----+----------+-----------------+--------------+--------------+
|   1 | joe      | joe@example.com | d1           |        20.00 |
+-----+----------+-----------------+--------------+--------------+
1 row in set (0.00 sec)

mysql> select * from usersdiscounts;+---------+-------------+
| user_id | discount_id |
+---------+-------------+
|       1 |           1 |
+---------+-------------+
1 row in set (0.00 sec)

mysql> 
mysql> insert into usersdiscounts (discountcode, discountrate) values ('d3',10), ('d4',5);
ERROR 1054 (42S22): Unknown column 'discountcode' in 'field list'
mysql> explain usersdiscounts;
+-------------+---------+------+-----+---------+-------+
| Field       | Type    | Null | Key | Default | Extra |
+-------------+---------+------+-----+---------+-------+
| user_id     | int(11) | NO   | PRI | NULL    |       |
| discount_id | int(11) | NO   | PRI | NULL    |       |
+-------------+---------+------+-----+---------+-------+
2 rows in set (0.00 sec)

mysql> insert into discounts (discountcode, discountrate) values ('d3',10), ('d4',5);
Query OK, 2 rows affected (0.05 sec)
Records: 2  Duplicates: 0  Warnings: 0

mysql> select * from discounts;
+----+--------------+--------------+
| id | discountcode | discountrate |
+----+--------------+--------------+
|  1 | d1           |        20.00 |
|  3 | d3           |        10.00 |
|  4 | d4           |         5.00 |
+----+--------------+--------------+
3 rows in set (0.00 sec)

mysql> select * from users;
+----+----------+------------------+
| id | username | email            |
+----+----------+------------------+
|  1 | joe      | joe@example.com  |
|  2 | jane     | jane@example.com |
+----+----------+------------------+
2 rows in set (0.00 sec)

mysql> insert into usersdiscounts (user_id, discount_id) values (1,3), (2,3), (2,4);
Query OK, 3 rows affected (0.05 sec)
Records: 3  Duplicates: 0  Warnings: 0

mysql> select * from usersdiscounts;
+---------+-------------+
| user_id | discount_id |
+---------+-------------+
|       1 |           1 |
|       1 |           3 |
|       2 |           3 |
|       2 |           4 |
+---------+-------------+
4 rows in set (0.00 sec)

mysql> select users.id as uid, username, email, discountcode, discountrate from users, discounts, usersdiscounts where users.id = usersdiscounts.user_id and discounts.id = usersdiscounts.discount_id;
+-----+----------+------------------+--------------+--------------+
| uid | username | email            | discountcode | discountrate |
+-----+----------+------------------+--------------+--------------+
|   1 | joe      | joe@example.com  | d1           |        20.00 |
|   1 | joe      | joe@example.com  | d3           |        10.00 |
|   2 | jane     | jane@example.com | d3           |        10.00 |
|   2 | jane     | jane@example.com | d4           |         5.00 |
+-----+----------+------------------+--------------+--------------+
4 rows in set (0.00 sec)

mysql> update usersdiscounts set discount_id = 4 where user_id = users.id and users.id = 1;
ERROR 1054 (42S22): Unknown column 'users.id' in 'where clause'
mysql> update usersdiscounts set discount_id = 4 where user_id = 1;
ERROR 1062 (23000): Duplicate entry '1-4' for key 'PRIMARY'
mysql> select * from usersdiscounts;
+---------+-------------+
| user_id | discount_id |
+---------+-------------+
|       1 |           1 |
|       1 |           3 |
|       2 |           3 |
|       2 |           4 |
+---------+-------------+
4 rows in set (0.00 sec)

mysql> explain usersdiscounts;
+-------------+---------+------+-----+---------+-------+
| Field       | Type    | Null | Key | Default | Extra |
+-------------+---------+------+-----+---------+-------+
| user_id     | int(11) | NO   | PRI | NULL    |       |
| discount_id | int(11) | NO   | PRI | NULL    |       |
+-------------+---------+------+-----+---------+-------+
2 rows in set (0.00 sec)

mysql> update usersdiscounts set discount_id = 4 where discount_id = 3 and user_id = 1;
Query OK, 1 row affected (0.04 sec)
Rows matched: 1  Changed: 1  Warnings: 0

mysql> select users.id as uid, username, email, discountcode, discountrate from users, discounts, usersdiscounts where users.id = usersdiscounts.user_id and discounts.id = usersdiscounts.discount_id;
+-----+----------+------------------+--------------+--------------+
| uid | username | email            | discountcode | discountrate |
+-----+----------+------------------+--------------+--------------+
|   1 | joe      | joe@example.com  | d1           |        20.00 |
|   2 | jane     | jane@example.com | d3           |        10.00 |
|   1 | joe      | joe@example.com  | d4           |         5.00 |
|   2 | jane     | jane@example.com | d4           |         5.00 |
+-----+----------+------------------+--------------+--------------+
4 rows in set (0.01 sec)

mysql> select users.id as uid, username, email, discountcode, discountrate from users, discounts, usersdiscounts where users.id = usersdiscounts.user_id and discounts.id = usersdiscounts.discount_id group by username;
+-----+----------+------------------+--------------+--------------+
| uid | username | email            | discountcode | discountrate |
+-----+----------+------------------+--------------+--------------+
|   2 | jane     | jane@example.com | d3           |        10.00 |
|   1 | joe      | joe@example.com  | d1           |        20.00 |
+-----+----------+------------------+--------------+--------------+
2 rows in set (0.00 sec)

mysql> select users.id as uid, username, email, discountcode, discountrate from users, discounts, usersdiscounts where users.id = usersdiscounts.user_id and discounts.id = usersdiscounts.discount_id order by username;
+-----+----------+------------------+--------------+--------------+
| uid | username | email            | discountcode | discountrate |
+-----+----------+------------------+--------------+--------------+
|   2 | jane     | jane@example.com | d3           |        10.00 |
|   2 | jane     | jane@example.com | d4           |         5.00 |
|   1 | joe      | joe@example.com  | d4           |         5.00 |
|   1 | joe      | joe@example.com  | d1           |        20.00 |
+-----+----------+------------------+--------------+--------------+
4 rows in set (0.00 sec)

mysql> select users.id as uid, username, email, discountcode, discountrate from users, discounts, usersdiscounts where users.id = usersdiscounts.user_id and discounts.id = usersdiscounts.discount_id order by uid;
+-----+----------+------------------+--------------+--------------+
| uid | username | email            | discountcode | discountrate |
+-----+----------+------------------+--------------+--------------+
|   1 | joe      | joe@example.com  | d4           |         5.00 |
|   1 | joe      | joe@example.com  | d1           |        20.00 |
|   2 | jane     | jane@example.com | d3           |        10.00 |
|   2 | jane     | jane@example.com | d4           |         5.00 |
+-----+----------+------------------+--------------+--------------+
4 rows in set (0.00 sec)

mysql> update usersdiscounts,users set discount_id = 3 where discount_id = 4 and users.id = 1;ERROR 1062 (23000): Duplicate entry '2-3' for key 'PRIMARY'
mysql> select * from users, usersdiscounts where discount_id = 4 users.id = 1;
ERROR 1064 (42000): You have an error in your SQL syntax; check the manual that corresponds to your MySQL server version for the right syntax to use near 'users.id = 1' at line 1
mysql> select * from users, usersdiscounts where discount_id = 4 and users.id = 1;
+----+----------+-----------------+---------+-------------+
| id | username | email           | user_id | discount_id |
+----+----------+-----------------+---------+-------------+
|  1 | joe      | joe@example.com |       1 |           4 |
|  1 | joe      | joe@example.com |       2 |           4 |
+----+----------+-----------------+---------+-------------+
2 rows in set (0.01 sec)

mysql> select * from users, usersdiscounts where discount_id = 4 and user_id = users.id  and users.id = 1;
+----+----------+-----------------+---------+-------------+
| id | username | email           | user_id | discount_id |
+----+----------+-----------------+---------+-------------+
|  1 | joe      | joe@example.com |       1 |           4 |
+----+----------+-----------------+---------+-------------+
1 row in set (0.00 sec)

mysql> update users, usersdiscounts set discount_id = 3  where discount_id = 4 and user_id = users.id  and users.id = 1;
Query OK, 1 row affected (0.04 sec)
Rows matched: 1  Changed: 1  Warnings: 0

mysql> select users.id as uid, username, email, discountcode, discountrate from users, discounts, usersdiscounts where users.id = usersdiscounts.user_id and discounts.id = usersdiscounts.discount_id order by uid;
+-----+----------+------------------+--------------+--------------+
| uid | username | email            | discountcode | discountrate |
+-----+----------+------------------+--------------+--------------+
|   1 | joe      | joe@example.com  | d3           |        10.00 |
|   1 | joe      | joe@example.com  | d1           |        20.00 |
|   2 | jane     | jane@example.com | d3           |        10.00 |
|   2 | jane     | jane@example.com | d4           |         5.00 |
+-----+----------+------------------+--------------+--------------+
4 rows in set (0.00 sec)

mysql> delete from usersdiscounts, users, discounts where discounts.discountcode = 'd4' and users.username = 'jane' ;
ERROR 1064 (42000): You have an error in your SQL syntax; check the manual that corresponds to your MySQL server version for the right syntax to use near 'where discounts.discountcode = 'd4' and users.username = 'jane'' at line 1
mysql> selecct * from usersdiscounts, users, discounts where discounts.discountcode = 'd4' and users.username = 'jane' ;
ERROR 1064 (42000): You have an error in your SQL syntax; check the manual that corresponds to your MySQL server version for the right syntax to use near 'selecct * from usersdiscounts, users, discounts where discounts.discountcode = '' at line 1
mysql> select * from usersdiscounts, users, discounts where discounts.discountcode = 'd4' and users.username = 'jane' ;
+---------+-------------+----+----------+------------------+----+--------------+--------------+
| user_id | discount_id | id | username | email            | id | discountcode | discountrate |
+---------+-------------+----+----------+------------------+----+--------------+--------------+
|       1 |           1 |  2 | jane     | jane@example.com |  4 | d4           |         5.00 |
|       1 |           3 |  2 | jane     | jane@example.com |  4 | d4           |         5.00 |
|       2 |           3 |  2 | jane     | jane@example.com |  4 | d4           |         5.00 |
|       2 |           4 |  2 | jane     | jane@example.com |  4 | d4           |         5.00 |
+---------+-------------+----+----------+------------------+----+--------------+--------------+
4 rows in set (0.02 sec)

mysql> select * from usersdiscounts, users, discounts where discounts.discountcode = 'd4' and users.username = 'jane' and user_id = users.id and discounts_id = discounts.id;
ERROR 1054 (42S22): Unknown column 'discounts_id' in 'where clause'
mysql> select * from usersdiscounts, users, discounts where discounts.discountcode = 'd4' and users.username = 'jane' and user_id = users.id and discount_id = discounts.id;
+---------+-------------+----+----------+------------------+----+--------------+--------------+
| user_id | discount_id | id | username | email            | id | discountcode | discountrate |
+---------+-------------+----+----------+------------------+----+--------------+--------------+
|       2 |           4 |  2 | jane     | jane@example.com |  4 | d4           |         5.00 |
+---------+-------------+----+----------+------------------+----+--------------+--------------+
1 row in set (0.00 sec)

mysql> delete from usersdiscounts, users, discounts where discounts.discountcode = 'd4' and users.username = 'jane' and user_id = users.id and discount_id = discounts.id;
ERROR 1064 (42000): You have an error in your SQL syntax; check the manual that corresponds to your MySQL server version for the right syntax to use near 'where discounts.discountcode = 'd4' and users.username = 'jane' and user_id = us' at line 1
mysql> delete ud from usersdiscounts ud, users u, discounts d where ud.user_id = u.id and ud.discount_id = d.id and d.discountcode = 'd4' and u.id = 2;
Query OK, 1 row affected (0.04 sec)

mysql> select * from usersdiscounts, users, discounts where discounts.discountcode = 'd4' and users.username = 'jane' and user_id = users.id and discount_id = discounts.id;
Empty set (0.01 sec)

mysql> select * from usersdiscounts, users, discounts where users.username = 'jane';
+---------+-------------+----+----------+------------------+----+--------------+--------------+
| user_id | discount_id | id | username | email            | id | discountcode | discountrate |
+---------+-------------+----+----------+------------------+----+--------------+--------------+
|       1 |           1 |  2 | jane     | jane@example.com |  1 | d1           |        20.00 |
|       1 |           3 |  2 | jane     | jane@example.com |  1 | d1           |        20.00 |
|       2 |           3 |  2 | jane     | jane@example.com |  1 | d1           |        20.00 |
|       1 |           1 |  2 | jane     | jane@example.com |  3 | d3           |        10.00 |
|       1 |           3 |  2 | jane     | jane@example.com |  3 | d3           |        10.00 |
|       2 |           3 |  2 | jane     | jane@example.com |  3 | d3           |        10.00 |
|       1 |           1 |  2 | jane     | jane@example.com |  4 | d4           |         5.00 |
|       1 |           3 |  2 | jane     | jane@example.com |  4 | d4           |         5.00 |
|       2 |           3 |  2 | jane     | jane@example.com |  4 | d4           |         5.00 |
+---------+-------------+----+----------+------------------+----+--------------+--------------+
9 rows in set (0.00 sec)

mysql> select * from usersdiscounts;
+---------+-------------+
| user_id | discount_id |
+---------+-------------+
|       1 |           1 |
|       1 |           3 |
|       2 |           3 |
+---------+-------------+
3 rows in set (0.00 sec)

mysql> select u.id as uid, username, email, d.id as did, discountcode, discountrate, from users u, discounts d, usersdiscounts ud where ud.user_id = u.id and ud.discount_id = d.id;
ERROR 1064 (42000): You have an error in your SQL syntax; check the manual that corresponds to your MySQL server version for the right syntax to use near 'from users u, discounts d, usersdiscounts ud where ud.user_id = u.id and ud.disc' at line 1
mysql> select users.id as uid, username, email, discountcode, discountrate from users, discounts, usersdiscounts where users.id = usersdiscounts.user_id and discounts.id = usersdiscounts.discount_id order by uid;
+-----+----------+------------------+--------------+--------------+
| uid | username | email            | discountcode | discountrate |
+-----+----------+------------------+--------------+--------------+
|   1 | joe      | joe@example.com  | d3           |        10.00 |
|   1 | joe      | joe@example.com  | d1           |        20.00 |
|   2 | jane     | jane@example.com | d3           |        10.00 |
+-----+----------+------------------+--------------+--------------+
3 rows in set (0.00 sec)

mysql> 
